{
  "schema_version": "1.0.0",
  "formalism_id": "AEX-RELATIONAL-ADMISSIBILITY-001",
  "repository": "Admissible-Existence/.github",
  "maturity": "EXECUTABLY_FORMALIZED",
  "authority_effect": "NONE_VALIDATION_ONLY",
  "forms": {
    "prose": {"paths": ["docs/RELATIONAL_ADMISSIBILITY_FORMALISM.md"]},
    "mathematics": {"paths": ["data/relational-admissibility-formalism.json", "schemas/relational-admissibility-transition.schema.json"]},
    "code": {"paths": ["scripts/validate_relational_admissibility_formalism.py", "fixtures/relational-admissibility/cases.json"]}
  },
  "principles": [
    {
      "principle_id": "A1",
      "title": "resolution realization",
      "normative": true,
      "prose_binding": "docs/RELATIONAL_ADMISSIBILITY_FORMALISM.md#A1",
      "mathematical_binding": "data/relational-admissibility-formalism.json#A1",
      "code_binding": "scripts/validate_relational_admissibility_formalism.py#A1",
      "assumptions": ["a governed resolution has predecessor and successor state identities"],
      "invariants": ["valid resolution is represented by a realized successor state"],
      "unknown_class_relevance": "NONE",
      "witnesses": ["fixtures/relational-admissibility/cases.json"],
      "counterexamples": [],
      "proof_status": "CANDIDATE",
      "falsification_conditions": ["a valid resolution exists with no realized successor state"],
      "equivalence_status": "BOUND_CANDIDATE"
    },
    {
      "principle_id": "A2",
      "title": "resolution class and successor-state separation",
      "normative": true,
      "prose_binding": "docs/RELATIONAL_ADMISSIBILITY_FORMALISM.md#A2",
      "mathematical_binding": "data/relational-admissibility-formalism.json#A2",
      "code_binding": "scripts/validate_relational_admissibility_formalism.py#A2",
      "assumptions": ["resolution class is not identical to state existence"],
      "invariants": ["DENY, REVIEW, and FAIL_CLOSED may each produce real successor states"],
      "unknown_class_relevance": "DECLARED",
      "witnesses": ["fixtures/relational-admissibility/cases.json"],
      "counterexamples": [],
      "proof_status": "CANDIDATE",
      "falsification_conditions": ["a non-ALLOW resolution is necessarily equivalent to no transition"],
      "equivalence_status": "BOUND_CANDIDATE"
    },
    {
      "principle_id": "A3",
      "title": "requested-effect separation",
      "normative": true,
      "prose_binding": "docs/RELATIONAL_ADMISSIBILITY_FORMALISM.md#A3",
      "mathematical_binding": "data/relational-admissibility-formalism.json#A3",
      "code_binding": "scripts/validate_relational_admissibility_formalism.py#A3",
      "assumptions": ["resolution validity and requested-effect realization are distinct variables"],
      "invariants": ["resolution_valid != requested_effect_authorized != requested_effect_realized"],
      "unknown_class_relevance": "NONE",
      "witnesses": ["fixtures/relational-admissibility/cases.json"],
      "counterexamples": [],
      "proof_status": "CANDIDATE",
      "falsification_conditions": ["requested-effect denial necessarily invalidates resolution"],
      "equivalence_status": "BOUND_CANDIDATE"
    },
    {
      "principle_id": "A4",
      "title": "confirmation non-nullity",
      "normative": true,
      "prose_binding": "docs/RELATIONAL_ADMISSIBILITY_FORMALISM.md#A4",
      "mathematical_binding": "data/relational-admissibility-formalism.json#A4",
      "code_binding": "scripts/validate_relational_admissibility_formalism.py#A4",
      "assumptions": ["confirmation adds provenance or observation relation"],
      "invariants": ["Delta(object_value)=0 does not imply Delta(system_state)=0"],
      "unknown_class_relevance": "DECLARED",
      "witnesses": ["fixtures/relational-admissibility/cases.json"],
      "counterexamples": [],
      "proof_status": "CANDIDATE",
      "falsification_conditions": ["confirmation can be semantically identical to absence of observation"],
      "equivalence_status": "BOUND_CANDIDATE"
    },
    {
      "principle_id": "A5",
      "title": "relational closure",
      "normative": true,
      "prose_binding": "docs/RELATIONAL_ADMISSIBILITY_FORMALISM.md#A5",
      "mathematical_binding": "data/relational-admissibility-formalism.json#A5",
      "code_binding": "scripts/validate_relational_admissibility_formalism.py#A5",
      "assumptions": ["coupled state changes may have organization-level relations"],
      "invariants": ["local validity does not imply organization-level relational admissibility"],
      "unknown_class_relevance": "CANDIDATE",
      "witnesses": ["fixtures/relational-admissibility/cases.json"],
      "counterexamples": [],
      "proof_status": "CANDIDATE",
      "falsification_conditions": ["all locally valid component changes are necessarily globally admissible"],
      "equivalence_status": "BOUND_CANDIDATE"
    },
    {
      "principle_id": "A6",
      "title": "concern-set propagation",
      "normative": true,
      "prose_binding": "docs/RELATIONAL_ADMISSIBILITY_FORMALISM.md#A6",
      "mathematical_binding": "data/relational-admissibility-formalism.json#A6",
      "code_binding": "scripts/validate_relational_admissibility_formalism.py#A6",
      "assumptions": ["relevant coupled concerns are represented"],
      "invariants": ["material relations propagate into the governed concern set"],
      "unknown_class_relevance": "REQUIRED",
      "witnesses": ["fixtures/relational-admissibility/cases.json"],
      "counterexamples": [],
      "proof_status": "CANDIDATE",
      "falsification_conditions": ["a represented material relation may be omitted without changing admissibility semantics"],
      "equivalence_status": "BOUND_CANDIDATE"
    },
    {
      "principle_id": "A7",
      "title": "transition-caused observation",
      "normative": true,
      "prose_binding": "docs/RELATIONAL_ADMISSIBILITY_FORMALISM.md#A7",
      "mathematical_binding": "data/relational-admissibility-formalism.json#A7",
      "code_binding": "scripts/validate_relational_admissibility_formalism.py#A7",
      "assumptions": ["observation is tied to transition evidence rather than periodic causation"],
      "invariants": ["periodic heartbeat is not the primitive cause of transition observation"],
      "unknown_class_relevance": "DECLARED",
      "witnesses": ["fixtures/relational-admissibility/cases.json"],
      "counterexamples": [],
      "proof_status": "CANDIDATE",
      "falsification_conditions": ["periodicity alone establishes transition observation"],
      "equivalence_status": "BOUND_CANDIDATE"
    },
    {
      "principle_id": "A8",
      "title": "composition sensitivity",
      "normative": true,
      "prose_binding": "docs/RELATIONAL_ADMISSIBILITY_FORMALISM.md#A8",
      "mathematical_binding": "data/relational-admissibility-formalism.json#A8",
      "code_binding": "scripts/validate_relational_admissibility_formalism.py#A8",
      "assumptions": ["component relations can create composite effects"],
      "invariants": ["composition may alter admissibility despite locally valid components"],
      "unknown_class_relevance": "REQUIRED",
      "witnesses": ["fixtures/relational-admissibility/cases.json"],
      "counterexamples": [],
      "proof_status": "CANDIDATE",
      "falsification_conditions": ["composition can never change admissibility of individually valid components"],
      "equivalence_status": "BOUND_CANDIDATE"
    },
    {
      "principle_id": "A9",
      "title": "authority non-generation",
      "normative": true,
      "prose_binding": "docs/RELATIONAL_ADMISSIBILITY_FORMALISM.md#A9",
      "mathematical_binding": "data/relational-admissibility-formalism.json#A9",
      "code_binding": "scripts/validate_relational_admissibility_formalism.py#A9",
      "assumptions": ["validation and observation are non-authoritative"],
      "invariants": ["validation cannot create execution, release, credential, or admissibility authority"],
      "unknown_class_relevance": "NONE",
      "witnesses": ["scripts/validate_relational_admissibility_formalism.py"],
      "counterexamples": [],
      "proof_status": "CANDIDATE",
      "falsification_conditions": ["a validation-only surface can grant authority by successful execution"],
      "equivalence_status": "BOUND_CANDIDATE"
    }
  ]
}
